source_id,citation,doi,benchmark_tier,study_country,region,coords,aez,farming_system,method_type,spatial_scale,analysis_resolution_m,nbs_ids,vars_extracted,extraction_status,extraction_date,extraction_run_id,extractor,source_kind,url,artifact_sha1,retrieved_at
batcheler_silvopasture_2024,"Batcheler, M. et al. (2024). Assessing silvopasture management as a strategy to reduce fuel loads and mitigate wildfire risk. Scientific Reports.",10.1038/s41598-024-56104-3,medium,United States,Washington,,temperate_europe,pastoral_rangeland,empirical,plot,,agroforestry,annual_precipitation|land_cover|mean_annual_temperature|slope|tree_canopy_cover,complete,2026-06-16,reextract_2026-06-16,claude-sonnet-4-6 (gated pipeline),paper,https://doi.org/10.1038/s41598-024-56104-3,fe693702ab9d5a4b3758fdfcf77c63ebfb53b0a9,2026-06-16
castle_sr_2021,"Castle, S. E. et al. (2021). The impacts of agroforestry on agricultural productivity, ecosystem services, and human well‐being in low‐ and middle‐income countries: A systematic review. Campbell Systematic Reviews.",10.1002/cl2.1167,high,Global,LMICs,,,,empirical,global,,agroforestry,extension_governance|finance_credit_access|labour_availability|market_value_chain|tenure_security,complete,2026-06-16,reextract_2026-06-16,claude-sonnet-4-6 (gated pipeline),paper,https://doi.org/10.1002/cl2.1167,95ba0f730eda9ca268bf108b0ce70415fd271b6a,2026-06-16
fesenmyer_2025,"Fesenmyer, K. A. et al. (2025). Addressing critiques refines global estimates of reforestation potential for climate change mitigation. Nature Communications, 16, 4572.",10.1038/s41467-025-59799-8,high,Global,,,,,empirical,global,30,agroforestry,accessibility_travel_time|slope|tenure_security|tree_canopy_cover,complete,2026-06-16,reextract_2026-06-16,claude-sonnet-4-6 (gated pipeline),paper,https://doi.org/10.1038/s41467-025-59799-8,b90c836e56652633f6e9f538201f4143a7b91d09,2026-06-16
quandt_resilience_2017,"Quandt, A. et al. (2017). The role of agroforestry in building livelihood resilience to floods and drought in semiarid Kenya. Ecology and Society.",10.5751/es-09461-220310,high,Kenya,East Africa,,semi_arid,mixed_crop_livestock,empirical,subnational,,agroforestry,,swept_no_evidence,2026-06-16,reextract_2026-06-16,claude-sonnet-4-6 (gated pipeline),paper,https://doi.org/10.5751/es-09461-220310,75bd76775c787da43afc12ce162431d7c4aff7a5,2026-06-16
sprenkle_hyppolite_2024,"Sprenkle-Hyppolite, S., Griscom, B., Griffey, V., Munshi, E., & Chapman, M. (2024). Maximizing tree carbon in croplands and grazing lands while sustaining yields. Carbon Balance and Management, 19(1), 23.",10.1186/s13021-024-00268-y,high,Global,,,,,empirical,global,1000,agroforestry,tree_canopy_cover,complete,2026-06-16,reextract_2026-06-16,claude-sonnet-4-6 (gated pipeline),paper,https://doi.org/10.1186/s13021-024-00268-y,85f5acfeb83118beb3ec09bf83fa9235d541ad4d,2026-06-16
wb_fsrp_2022,World Bank (2022). Food Systems Resilience Program for Eastern and Southern Africa. Project Appraisal Document.,P178566,high,Regional,SSA,,,,empirical,regional,,agroforestry,conflict_fragility_index|extension_governance|soil_organic_carbon|soil_ph|tenure_security,complete,2026-06-16,reextract_2026-06-16,claude-sonnet-4-6 (gated pipeline),grey_lit,,e7bd9f44568b3406acfbbbf9555f965261cd0ca2,2026-06-16
wb_kcsap_2016,World Bank (2016). Kenya Climate Smart Agriculture Project. Project Appraisal Document.,P154784,high,Kenya,SSA,,,,empirical,national,,agroforestry,annual_precipitation|aridity_index|extension_governance|finance_credit_access|land_cover|market_value_chain|tenure_security,complete,2026-06-16,reextract_2026-06-16,claude-sonnet-4-6 (gated pipeline),grey_lit,,1c5351ef8b4eb07d1dab9855853bb2f71d8b767a,2026-06-16
zomer_2014,"Zomer et al. (2014). Trees on farm, global.",10.1038/srep29987,high,Global,,,,,empirical,global,1000,agroforestry,aridity_index|land_cover|tree_canopy_cover,complete,2026-06-16,reextract_2026-06-16,claude-sonnet-4-6 (gated pipeline),paper,https://doi.org/10.1038/srep29987,531e7714686874b93834f34a90f383ccadb8be36,2026-06-16
