search_id,nbs_id,suitability_family_id,table,category,search_terms,screening_steps,inclusion_criteria,limits,n_retrieved,n_screened,n_included,search_date,run_id,searched_by,ruleset_version,discovery_log_ref,note
agroforestry__T4__stock__stocktake-2026,agroforestry,,T4,stock,"OpenAlex 3-block AND query, top 300 papers/practice by relevance. Block 1 practice: (""agroforestry"" OR ""agro-forestry"" OR ""trees on farms"" OR ""tree-based system*"" OR ""agrosilvopastoral*"" OR ""silvopastoral*"" OR ""agro-silvo-pastoral*"" OR ""tree-livestock system*""). AND Block 2 climate relevance: (""climate"" OR ""climate change"" OR ""drought"" OR ""flood*"" OR ""fire"" OR ""heat"" OR ""temperature"" OR ""rainfall"" OR ""precipitation"" OR ""erosion"" OR ""water stress"" OR ""hazard"" OR ""risk"" OR ""extreme event*""). AND Block 3 spatial output: (""map*"" OR ""index"" OR ""ranking"" OR ""priority area*"" OR ""classification"" OR ""suitability class*"" OR ""scenario*"" OR ""assessment""). Verbatim from stocktake Annex 1 (reference/stocktake/_local/stocktake_review.txt).",frame|source_type|relevance|credibility_six_axis|saturation_stop,"practice-level AF suitability thresholds (biophysical/system); exclude species-envelope, restoration/pure-forestry, study-site descriptors, constrained-AOI schemes",cap ~10-20 sources/NbS×table; C/I/D tiered,300,,23,2026-06-06,relverify_2026-06,Lolita Muller (screening) / Pete,v1.0,agroforestry_T4.md; reference/stocktake/,Foundational stocktake; table-level (NOT per sub-practice). Search string verbatim from Annex 1; practice synonyms incl. silvopastoral/agrosilvopastoral. Counts AF-specific: ~300 retrieved (top-300 for the AF practice query) -> 23 AF rows in the 220-row all-NbS benchmarked corpus (~3000 retrieved across 10 practices).
agroforestry__T3__stock__stocktake-2026,agroforestry,,T3,stock,"OpenAlex 3-block AND query, top 300 papers/practice by relevance. Block 1 practice: (""agroforestry"" OR ""agro-forestry"" OR ""trees on farms"" OR ""tree-based system*"" OR ""agrosilvopastoral*"" OR ""silvopastoral*"" OR ""agro-silvo-pastoral*"" OR ""tree-livestock system*""). AND Block 2 climate relevance: (""climate"" OR ""climate change"" OR ""drought"" OR ""flood*"" OR ""fire"" OR ""heat"" OR ""temperature"" OR ""rainfall"" OR ""precipitation"" OR ""erosion"" OR ""water stress"" OR ""hazard"" OR ""risk"" OR ""extreme event*""). AND Block 3 spatial output: (""map*"" OR ""index"" OR ""ranking"" OR ""priority area*"" OR ""classification"" OR ""suitability class*"" OR ""scenario*"" OR ""assessment""). Verbatim from stocktake Annex 1 (reference/stocktake/_local/stocktake_review.txt).",frame|source_type|relevance|credibility_six_axis|saturation_stop,AF x climate-hazard mitigation (which hazards the practice buffers); exclude generic CC narrative,cap ~10-20 sources/NbS×table; C/I/D tiered,300,,23,2026-06-06,relverify_2026-06,Lolita Muller (screening) / Pete,v1.0,agroforestry_T3.md; reference/stocktake/,Foundational stocktake; table-level (NOT per sub-practice). Search string verbatim from Annex 1; practice synonyms incl. silvopastoral/agrosilvopastoral. Counts AF-specific: ~300 retrieved (top-300 for the AF practice query) -> 23 AF rows in the 220-row all-NbS benchmarked corpus (~3000 retrieved across 10 practices).
agroforestry__T6__stock__stocktake-2026,agroforestry,,T6,stock,"OpenAlex 3-block AND query, top 300 papers/practice by relevance. Block 1 practice: (""agroforestry"" OR ""agro-forestry"" OR ""trees on farms"" OR ""tree-based system*"" OR ""agrosilvopastoral*"" OR ""silvopastoral*"" OR ""agro-silvo-pastoral*"" OR ""tree-livestock system*""). AND Block 2 climate relevance: (""climate"" OR ""climate change"" OR ""drought"" OR ""flood*"" OR ""fire"" OR ""heat"" OR ""temperature"" OR ""rainfall"" OR ""precipitation"" OR ""erosion"" OR ""water stress"" OR ""hazard"" OR ""risk"" OR ""extreme event*""). AND Block 3 spatial output: (""map*"" OR ""index"" OR ""ranking"" OR ""priority area*"" OR ""classification"" OR ""suitability class*"" OR ""scenario*"" OR ""assessment""). Verbatim from stocktake Annex 1 (reference/stocktake/_local/stocktake_review.txt).",frame|source_type|relevance|credibility_six_axis|saturation_stop,"AF outcomes/effects + indicative cost (scoping-grade, not CBA); grey benefit claims discounted",cap ~10-20 sources/NbS×table; C/I/D tiered,300,,23,2026-06-06,relverify_2026-06,Lolita Muller (screening) / Pete,v1.0,agroforestry_T6.md; reference/stocktake/,Foundational stocktake; table-level (NOT per sub-practice). Search string verbatim from Annex 1; practice synonyms incl. silvopastoral/agrosilvopastoral. Counts AF-specific: ~300 retrieved (top-300 for the AF practice query) -> 23 AF rows in the 220-row all-NbS benchmarked corpus (~3000 retrieved across 10 practices).
agroforestry__T4__updated_lit__openalex-2026-06,agroforestry,,T4,updated_lit,6 OpenAlex title queries: agroforestry x (suitability | land evaluation | priority areas | multicriteria/GIS | silvopasture | opportunity mapping); from_publication_date:2024-01-01; type:article; sort by cites,frame|source_type|relevance|credibility_six_axis|saturation_stop,"practice-level AF suitability thresholds (biophysical/system); exclude species-envelope, restoration/pure-forestry, study-site descriptors, constrained-AOI schemes; novel vs the 220-row stocktake; open-access",retrieve<=200/query; screen<=50 abstracts; acquire+extract<=15,31,29,4,2026-06-19,openalex_af_2026-06,Pete (orchestrated),v1.0,agroforestry_openalex_sweep_2026-06.md,4 acquired+extracted (2 acquire-failed); 23 deferred in reference/discovery/openalex_candidates.csv. Table-level.
agroforestry__T6__updated_lit__openalex-2026-06,agroforestry,,T6,updated_lit,6 OpenAlex title queries: agroforestry x (suitability | land evaluation | priority areas | multicriteria/GIS | silvopasture | opportunity mapping); from_publication_date:2024-01-01; type:article; sort by cites,frame|source_type|relevance|credibility_six_axis|saturation_stop,"AF outcomes/effects + indicative cost (scoping-grade, not CBA); grey benefit claims discounted; novel vs the 220-row stocktake; open-access",retrieve<=200/query; screen<=50 abstracts; acquire+extract<=15,31,29,4,2026-06-19,openalex_af_2026-06,Pete (orchestrated),v1.0,agroforestry_openalex_sweep_2026-06.md,4 acquired+extracted (2 acquire-failed); 23 deferred in reference/discovery/openalex_candidates.csv. Table-level.
agroforestry__T4__grey__webgrey-2026-06,agroforestry,,T4,grey,iterative web (EN/ES/FR): AF land-suitability tools/methods; silvopasture GIS mapping; FMNR/parkland Sahel targeting; cocoa/coffee shade zoning + national AF atlases; multilingual aptitude/aptitud agroforesterie cartografia,frame|source_type|relevance|credibility_six_axis|saturation_stop,"practice-level AF suitability thresholds (biophysical/system); exclude species-envelope, restoration/pure-forestry, study-site descriptors, constrained-AOI schemes; grey positive-bias discount applied","exploratory, iterative; cap ~10-20/NbS×table",,,2,2026-06-20,grey_af_2026-06,Pete (orchestrated),v1.0,agroforestry_grey_websearch_2026-06.md,INAB Guatemala (50 EV) + CRS FMNR Niger (17 EV); WRI ROAM dropped off-NbS; 2x HTTP-403. WOCAT token-walled (parked).
agroforestry__T4__grey__cgspace-2026-06,agroforestry,,T4,grey,"CGSpace DSpace API, 4 queries: 'agroforestry land suitability mapping criteria'; 'agroforestry suitability soil slope rainfall classes'; 'silvopastoral land suitability'; 'land evaluation agroforestry FAO suitability classes S1 S2'",frame|source_type|relevance|credibility_six_axis|saturation_stop,"practice-level AF suitability thresholds (biophysical/system); exclude species-envelope, restoration/pure-forestry, study-site descriptors, constrained-AOI schemes",~20 unique items screened; read-only API,,20,1,2026-06-23,cgspace_af_2026-06,Pete (orchestrated),v1.0,agroforestry_cgspace_2026-06.md,"1 study (singh South Asia, 5 EV via OA copy); rest metadata-only/off-scope/restoration/targeting-frameworks. Low yield for thresholds."
agroforestry__T4__tool__github-2026-06,agroforestry,,T4,tool,gh search repos: 'agroforestry suitability'; 'land-suitability AHP'; 'MCDA suitability mapping'; 'silvopasture GIS'; 'ecocrop suitability'; 'fuzzy land evaluation'; 'tree planting suitability'; + platforms (WOCAT/ICRAF SPACIAL/WRI FLR/ROAM),frame|source_type|relevance|credibility_six_axis|saturation_stop,tool/method/codebase whose code/docs state reusable AF suitability thresholds/weights/criteria; ignore species-envelope scripts; PICOS: practice must be in the tool,single strong terms (multi-term unreliable); pending_review,,,7,2026-06-21,tool_af_2026-06,Pete (orchestrated),v1.0,agroforestry_tools_search_2026-06.md,"7 tools registered; saraheb3 GEE code -> 13 file-line EV. GAP: ICRAF/CIFOR methods under-found (search-coverage failure, not absence)."
